{
  "schema_version": 1,
  "profile_id": "phase54.6-gameplay-formal-v1",
  "evidence_class": "formal",
  "process_runs": 5,
  "warmup_samples": 5,
  "timed_samples": 30,
  "seed": 1397313,
  "calibration": {
    "confirmation_samples": 3,
    "minimum_sample_milliseconds": 5.0,
    "minimum_iterations": 1,
    "maximum_iterations": 65536
  },
  "validity": {
    "data_lane_max_crossing_ratio": 0.5,
    "require_clean_tree": true,
    "raw_samples_tracked": false
  },
  "lanes": [
    "native_cpp",
    "puerts_v8_reflection",
    "puerts_v8_static",
    "avidscript_wasmtime_semantic",
    "avidscript_wasmtime_generated_s1",
    "avidscript_wasmtime_data_oriented"
  ],
  "workloads": [
    "gameplay_frame_small",
    "gameplay_frame_dense"
  ],
  "workload_contracts": {
    "gameplay_frame_small": {
      "logical_entities_per_frame": 1,
      "scalar_property_operations_per_entity": 64,
      "property_write_operations_per_frame": 32,
      "property_batches_per_frame": 8,
      "data_boundary_crossings_per_frame": 16,
      "fixture_function_calls_per_frame": 46,
      "vector_operations_per_entity": 8,
      "object_operations_per_entity": 4,
      "event_operations_per_entity": 2,
      "logical_operations_per_frame": 78,
      "actor_count": 1
    },
    "gameplay_frame_dense": {
      "logical_entities_per_frame": 1024,
      "scalar_property_operations_per_entity": 8,
      "property_write_operations_per_frame": 4096,
      "property_batches_per_frame": 1024,
      "data_boundary_crossings_per_frame": 2048,
      "fixture_function_calls_per_frame": 7168,
      "vector_operations_per_entity": 2,
      "object_or_event_operations_per_entity": 1,
      "logical_operations_per_frame": 11264,
      "actor_count": 1
    }
  },
  "avidscript_artifacts": {
    "avidscript_wasmtime_semantic": {
      "binding_invocation_mode": "semantic_process_event",
      "manifest_relative_path": "AvidScriptCSharpGuest/Profiles/profile_phase54_6_semantic/profile_phase54_6_semantic.avidscript.json"
    },
    "avidscript_wasmtime_generated_s1": {
      "binding_invocation_mode": "generated_native_s1",
      "manifest_relative_path": "AvidScriptCSharpGuest/Profiles/profile_phase54_6_generated_s1/profile_phase54_6_generated_s1.avidscript.json"
    },
    "avidscript_wasmtime_data_oriented": {
      "binding_invocation_mode": "data_command_buffer",
      "manifest_relative_path": "AvidScriptCSharpGuest/Profiles/profile_phase54_6_data_oriented/profile_phase54_6_data_oriented.avidscript.json",
      "metrics_contract": "FAvidScriptWasmSmokeResult.DataBridgeMetrics.v1"
    }
  },
  "gates": {
    "wasmtime_v8_geo_ratio": { "maximum": 0.95 },
    "kernel_win_rate": { "minimum": 0.60 },
    "semantic_vs_puerts_reflection": { "maximum": 0.80 },
    "s1_scalar_ns": { "maximum": 25.0 },
    "s1_vs_puerts_static": { "maximum": 0.90 },
    "s1_property_ns": { "maximum": 50.0 },
    "callback_ns": { "maximum": 150.0 },
    "callback_vs_puerts": { "maximum": 0.85 },
    "vector_vs_p54_5": { "maximum": 0.85 },
    "small_vs_best_puerts": {
      "maximum": 0.70,
      "lane": "avidscript_wasmtime_generated_s1"
    },
    "dense_vs_best_puerts": {
      "maximum": 0.70,
      "lane": "avidscript_wasmtime_data_oriented"
    },
    "typed_empty_explained_ratio": { "minimum": 0.70 }
  },
  "output": {
    "raw_process_samples": "external_evidence_only",
    "tracked_evidence": "hashes_and_summary_only",
    "include_personal_absolute_paths": false
  }
}
